Datei,Herkunft,Datierung,Übersetzung
"Quellenstellen zur Kultpraxis_Amenemhet, Lehre des",Saqqara,"Sethos II. einzige die 18.Dynasiie ist, nicht 19","Anfang der (wörtl.: aus/mit der) Lehre, die verfaßt hat die Majestät des Königs von Ober- und Unterägypten (Kartusche|Sehetep-ib-Re|Kartusche), der Sohn des Re (Kartusche|Amenemhat|Kartusche), der Gerechtfertigte, der (wörtl.: indem er) in einem Offenlegen der Wahrheit (d.h. in einer Vision?) zu seinem Sohn, dem Allherrn, spricht. Erschienen als Gott, sagt er:, Du sollst so schlafen, daß dein eigenes Herz für dich Wache hält, weil ein Mann (von Rang) am Unglückstag keine Anhänger hat (d.h. er bekommt keine Hilfe) (wörtl.: daß du schläfst, ist, indem dein eigenes Herz für dich Wache hält, weil es die Anhänger für einen Mann am Tag der Schwierigkeiten nicht gibt)., Die mit (meiner?) Myrrhe gesalbt waren, gossen Schmutzwasser aus (?; oder: verspritzten Urin?; oder: spuckten darauf?)., Meine lebenden Abbilder, mein Anteil an der Menschheit (d.h. der zu mir haltende Teil der Menschen), macht (?) mir meine Totenrede (?), (wie) man sie (noch) nicht gehört hat (wörtl.: die nicht gehört worden ist)!, Außerdem kämpft man auf dem Kampfplatz, (indem/wenn) das Gestern (d.h. die gute Sitte, der Maat-gerechte Zustand oder das, was einem seitens des Königs widerfahren ist) vergessen worden ist., Kein Unheil ist über mich gekommen, seit ich geboren wurde (oder: seit meiner Geburt)., Ich bin einer, der das Getreide erschaffen hat und der von Nepri (d.h. dem Getreidegott) geliebt wird, (nachdem) Hapi (d.h. der Überschwemmungsgott) mir auf jedem (Bewässerungs)bassin (?) Respekt erwiesen hat., Ich habe Löwen gebändigt und Krokodile gefangen (wörtl.: herbeigeführt)., Ich habe mir ein Haus (hier wahrscheinlich eine Grabanlage) errichtet, das mit Gold geschmückt ist; seine Decken sind aus Lapislazuli; die Mauern sind aus Silber; die Böden sind aus mnhy-Gestein (?); die Türen sind aus Kupfer; die Riegel sind aus Bronze; angefertigt für die Ewigkeit, vorbereitet für die Unendlichkeit., O Sesostris, mein Sohn, meine Füße gehen fort, während (?) mein eigenes Herz sich (dir/mir?) nähert (?; oder: du bist/dir gehört mein eigenes Herz), (indem/und) meine Augen dich betrachten., Die Kinder sind in einer Stunde der Herzensfreude an der Seite des Sonnenvolkes, (indem/während; oder: damit) sie dir Lobpreis bringen (?)., Siehe, ich habe die Vergangenheit (wörtl.: den Anfang) gestaltet, (damit) ich für dich die Zukunft (wörtl.: das Ende) anordnen kann., Du (?) bist der, der die weiße Krone des Gottessamens (d.h. des Königs als Nachkomme der Götter) trägt. Das bedeutet, daß die Sachen (?) an der richtigen Stelle (wörtl.: an der Stelle davon) sind, als etwas, was ich für dich angefangen (oder: bestimmt?) habe., Kaum war ich in die Barke des Re eingestiegen, da war das Königtum (wieder) von Anfang an entstanden, als etwas, was ich im Innern davon (d.h. in der Barke?) gemacht habe (??)., Errichte <deine?> Monumente (oder: Statuen)! Mache deine Grabkammer (?) hervorragend!, Anfang der (wörtl.: aus der) Lehre, die verfaßt hat die Majestät des Königs von Ober- und Unterägypten (Kartusche|Sehetep-ib-Re|Kartusche) - L.H.G. -, der Sohn des Re (Kartusche|Amenemhat|Kartusche) - L.H.G. -, der Gerechtfertigte, der (wörtl.: indem er) in einem Offenlegen der Wahrheit (d.h. in einer Vision?) zu seinem Sohn, dem Allherrn, spricht. Erschienen als Gott, sagt er:, Ich verbringe die Nacht damit, dein eigenes Herz für dich zu schützen, weil ich nicht zu den (unzuverlässigen) Anhängern eines Mannes (von Rang) an deinem Unglückstag gehöre., Die mit meiner Myrrhe gesalbt waren, vergossen das Wasser meines Getreidespeichers (oder: Fundaments)., Meine lebenden Abbilder als (?) (mein) Anteil an der Menschheit (d.h. der zu mir haltende Teil der Menschen), sie machen mir eine Totenrede (?) als eine, die (sonst) nicht gehört werden kann., Außerdem kämpft man auf dem Kampfplatz, (indem/wenn) das Gestern (d.h. die gute Sitte, der Maat-gerechte Zustand oder das, was einem seitens des Königs widerfahren ist) vergessen worden ist., <Unheil> ist nicht {zu mir} über mich gekommen, seit {den Kindern} <meiner Geburt>., Ich bin einer, der das Getreide erschaffen hat und der von Nepri (d.h. dem Getreidegott) geliebt wird, (nachdem) die Überschwemmung mir auf jedem (Bewässerungs)bassin (?) Respekt erwiesen hat., {Das Kollegium} <Ich habe> Löwen <gebändigt> und Krokodile gefangen (wörtl.: herbeigeführt)., Ich habe mir ein Haus (hier wahrscheinlich eine Grabanlage) errichtet, das mit Gold geschmückt ist; seine Decken sind aus Lapislazuli; die Mauern sind {dort} <aus Silber>; die Böden sind {herabgestiegen} aus <mnhy-Gestein (?)>; die Türen sind <aus> Kupfer; die Riegel sind <aus> Bronze; angefertigt für die Ewigkeit, vor der die Unendlichkeit sich fürchtet (oder: vorbereitet <für> die Unendlichkeit dadurch)., O Sesostris - L.H.G. -, deine Füße machen sich auf den Weg. Dir gehört dein eigenes Herz. Deine Augen betrachten mich., Die Kinder sind in einer Stunde der Herzensfreude an der Seite des Sonnenvolkes, wenn sie dir Lobpreis bringen (?)., Siehe, man handelt für mich an meinem Anfang, ich erschaffe (wörtl.: knote) für dich an meinem (?) Ende., Die Statuen tragen die weiße Krone, o Gottessamen. (?), Das Siegel ist an der {Stelle des Gefährten} <richtigen Stelle>, als etwas, was ich für dich angefangen (oder: bestimmt?) habe. {Gefäße} <Jubel> ist in der Barke des Re. Da ist dein Königtum erschaffen worden vor mir. (??), Errichte Statuen! Mache deine Grabkammer (?) hervorragend!, (Widmung:) für den Ka des fähigen Gelobten, dessen mit vollkommenem Verhalten, des Schreibers des Schatzhauses Qa-gabt, (sowie für den Ka) des Schreibers des Schatzhauses Hori."
"Quellenstellen zur Kultpraxis_Amenemope, Lehre des","Theben, westliches Ufer",Spätzeit,"Anfang der Lehre für (?) das Leben, der Anleitung zum Wohlbefinden, aller Vorschriften für den Umgang mit den Großen (wört.: des Begegnens der Großen), der Traditionen der ""Freunde"" (d.h. die Vorgehensweise gegenüber den Hofleuten), <um> dem eine Äußerung erwidern zu können, der sie gesagt hat, um dem Bericht zu erstatten, der ihn (mit einem Auftrag) ausgesandt hat, um sich richtig auf den Weg des Lebens zu führen, um für sein (eigenes) Wohlbefinden auf Erden zu sorgen, um sein Herz zu seinem Schrein hinabsteigen zu lassen, <um> sich/es vom Bösen (weg)zusteuern, um sich vor dem Gerede (wörtl.: Mund) der Leute zu retten, <um> gehuldigt zu werden im Mund der Untertanen;, Wenn du deine Zeit (auf Erden) verbringst, während dies in deinem Herzen ist, dann wirst du es (oder: sie, d.h. die Zeit?) als eine erfolgreiche Sache empfinden, dann wirst du meine Worte als ein Vorratshaus für das Leben empfinden, damit/so daß dein Körper auf Erden gedeihen wird., Der Sturm ist laut; die Krokodile sind böse. O Hitzkopf, wie ergeht es dir? Er schreit auf; seine Stimme (reicht) bis zum Himmel. Der Mondgott stellt sein Verbrechen fest., Richte ihn auf, gib ihm deine Hand, laß ihn (zurück) <in> (oder: überlaß ihn) den Händen Gottes!, Eine andere/weitere gute Tat in der Auffassung Gottes: (einen Augenblick) innezuhalten, bevor man spricht., Gott wird sich ihn vorzunehmen (wörtl.: zuzuwenden) wissen., Was den Hitzkopf im Tempel angeht: er ist wie ein Baum, der drinnen (?) wächst. Die Zeit eines Augenblicks (nur) gibt es das Sprießen seiner Triebe (oder: Nach kurzer Zeit wirft er seine Triebe ab); an der Holzablagestelle (?) wird er sein Ende finden (wörtl.: wird sein Ende herbeigeführt werden). Er ist geflößt (oder: treibt dahin), weit weg von seinem (ursprünglichen) Platz; das Feuer ist sein Begräbnis. Der wahrhaft Bescheidener, er hält sich abseits; er ist wie ein Baum, der im (lichtdurchfluteten) Obstgarten (?) wächst. Er grünt (d.h. gedeiht), so daß er seinen Ernteertrag verdoppelt; er ist im Blickfeld seines Herrn. Seine Früchte sind süß, sein Schatten ist angenehm. Im (Baum)garten wird er sein Ende finden (wörtl.: wird sein Ende herbeigeführt werden)., Entwende/erpresse (?) keinen Anteil des Tempels! Sei nicht unersättlich/gierig, damit du den Überfluß finden wirst! Schiebe keinen Diener des Gottes beiseite, um einem anderen einen Vorteil zu verschaffen!, Sage nicht: ""Heute ist wie Morgen""! Wie kann es dazu kommen (d.h. wie könnte ein solcher Zustand erreicht werden)? Der morgige Tag ist angebrochen; der heutige Tag ist vergangen., Die Flut ist zum Wellenkamm (?) geworden. Die Krokodile sind sichtbar (wörtl.: entblößt); die Nilpferde sind auf dem Trockenen; die Fische schnappen nach Luft (?; oder: sind abgekämpft/in einem Bedrängnis (?)). Die ""Wolfsschakale"" sind gesättigt/satt; die Vögel sind im Fest; die Fischnetze sind entleert/bleiben leer. Was jeden einzelnen Bescheidenen im Tempel (oder: des Tempels) angeht: sie (alle) sagen: ""Groß ist die Gunst des Re!"" Halte dich an den Bescheidenen, damit du das Leben (für gut) befindest, und damit dein Körper auf Erden wohlbehalten bleibt., Eine (zusätzliche) Furche beim Pflügen bedeutet ein Verringern der Lebenszeit: das, was du entwendet/erpresst hast, es gehört dem Feld., Wenn er/einer durch einen Meineid (etwas) erwirbt (wörtl.: mit dem Netz einfängt), ist er mittels der (strafenden) Machtserscheinung des Mondgottes (mit dem Lasso) eingefangen/gefesselt., Du kannst den, der dies auf Erden getan hat, dadurch erkennen, daß er einer ist, der gierig ist, gegenüber einem, der schwach ist, daß er ein Feind ist, der dich persönlich (oder: <sich selbst>?) zum Absturz bringen kann, daß (oder: wobei) das Leben aus (oder: mittels; oder: wegen (der Raffgier in)) seinem Auge geraubt worden ist, daß sein Haus ein Feind des Dorfes (d.h.: für das Dorf) ist, daß (oder: wobei) seine Scheunen zerstört sind, daß man seinen Besitz aus der Hand seiner Kinder wegnimmt, damit sein Eigentum einem anderen gegeben werden kann., Hüte dich, dich an die Ackergrenzen zu vergreifen, damit der Schrecken (Gottes) dich nicht mitnimmt. Man stellt den Gott zufrieden durch die Machtserscheinung des Herrn, der über die Grenzen des Fruchtlandes entschieden hat. Wünsche dir also, deinen Körper unversehrt zu halten; hüte dich vor dem Allherrn!, Nützlicher ist ein Scheffel (Getreide), das der Gott dir gegeben hat (wörtl.: indem der Gott es dir gegeben hat), als 5000 (Scheffel) aus Verbrechen (oder: durch Gewalt)., Nützlicher ist Armut in (oder: aus?) der Hand des Gottes als Reichtum im Magazin.  Nützlicher sind (kleine) Opferkuchen (die nach dem Gottesopfer verteilt werden), wenn das Herz froh ist, als Reichtum voller Kummer., Es gibt keinen, den Schai und Renenet nicht kennen (oder: Es gibt kein Ignorieren von Schai und Renenet)., Wenn dir aus Raub stammende Reichtümer gebracht werden, dann werden sie nicht bei dir übernachten. Wenn die Erde hell wird, sind sie nicht (mehr) in deinem Haus: (Gerade noch) hat man ihre Stelle gesehen; und dann gibt es sie nicht (mehr). Der Boden hat seinen Mund geöffnet, Reichtümer) begradigt (d.h. eingeebnet?), er hat sie (die Reichtümer) in sich verschluckt, damit sie in die Unterwelt versinken würden. Sie haben sich ein großes Loch ihrem Bedarf entsprechend gemacht. (Und) sie sind in der Grabestiefe versunken. Sie haben sich Flügel gemacht wie r'-Gänse; (und) sie sind zum Himmel geflogen., Wenn er aufgeht, sollst du ein Gebet an den Sonnengott richten, mit den Worten: ""Gib mir Wohlergehen und Gesundheit!"" Er möge dir deinen Lebensbedarf geben, wobei du vor dem Schrecken (Gottes) bewahrt bleibst., Man möge der Uräusschlange zujubeln. (Aber) spucke auf Apophis!, Du wirst deinen Platz im Tempel finden: deine Speisen bestehen aus den Opferbroten deines Herrn. Du wirst die Rolle eines Versorgten/Ehrwürdigen spielen; dein Sarg wird dich verbergen, damit du vor der (strafenden) Macht(serscheinung) Gottes bewahrt sein wirst., Was den Tag der Feststellung seiner Vergehen angeht: (das bedeutet) Wehgeschrei für seine Kinder. Chnum möge also nochmals eintreten/auftauchen, der Töpfer des Heißmauls: (Denn) es ist um die Herzen (von Schlechtem) abzulenken (?), daß er (den Lehm) knetet., er schädigt/zerstört seine Farbe (oder: sein Wesen) im (göttlichen) Sonnenlicht. Er legt seinen Schwanz wie das Jungtier eines Krokodils zusammen (wörtl.: umfaßt);, Fliege nicht hin, um dich jenen einzuverleiben (?), damit der Schrecken (Gottes) dich nicht mitnimmt., (Das ist) der Abscheu des Gottes., Trenne nicht dein Herz von deiner Zunge, damit alle deine Pläne Erfolg haben werden, damit <du> gewichtig wirst vor den Anderen, wobei <du> wohlbehalten in (oder: vor?) der Hand des Gottes bist. Gott hasst das Verfälschen der Worte. Sein größter Abscheu ist der innere Aufruhr (wörtl.: das Leiden des Leibes)., Mit einem Meineid bringt er (der Erwerber der Sache) sich vorwärts (oder: durch einen Meineid erwirbt er sie), wobei sein Herz in/aus seinem Leib herabgesetzt/benachteiligt (?) ist., Deine Schmeicheleien kehren (zu dir) zurück als Verwünschungen,
deine Huldigungen als Prügelstrafe., Du kannst einen Eindruck gewinnen von (?) der Aufsichtskraft eines armen Abhängigen, wenn der Prügelstock ihn berührt/getroffen hat, wenn alle seine Leute in der (Fuß)fessel festgesetzt sind, wenn irgendeiner <auf> dem Exekutionsblock (oder: <in> der Richtstätte) erschlagen ist., Hintergehe/benachteilige keinen Menschen <mit> der Schreibbinse an der Buchrolle! (Das ist) der Abscheu des Gottes., Du wirst es als/wie den Weg des Lebens (emp)finden. Dann kannst du schlafen gehen, damit (?) du die Nacht {wie} <bis zum> Morgen verbringst., Nützlicher sind Opferkuchen, wenn das Herz erfreut ist, als Reichtum beladen mit Kummer., Was den Schnabel (wörtl.: die Nase) des Ibis(gottes) betrifft: (das ist) der Finger des Schreibers. Hüte dich vor seinem (des Fingers) Entgleisen (oder: Hüte dich, ihn (den Ibis) beiseite zu schieben)! Zwar hat der Pavian im Tempel von Hermopolis (oder: im Haus-der-Achtheit) Platz genommen, aber sein Auge durchstreift währenddessen die Beiden Länder. Falls er den erblickt, der mit seinem Finger schwindelt/geschwindelt hat, dann greift er dessen Speisen für die (oder: mittels der) Flut., Wenn du deine Zeit (auf Erden) verbringst, während dies in deinem Herzen ist (d.h. während du dir diese Ratschläge zu Herzen nimmst), dann werden deine Kinder es (d.h. den Nutzen davon) sehen., Beeinflusse (wörtl.: abstützen, verschieben) nicht die Handwaage, verfälsche nicht die Kite-Gewichte, und beschädige/verringere nicht die Teile/Untergliederungen der Debeh-Meßgefäße!  Wünsche dir nicht ein (ungeeichtes?) Debeh-Meßgefäß des Feldes, und wirf nicht die (geeichten?) des Schatzhauses weg! Der Pavian sitzt neben der Standwaage, wobei (wohlgemerkt) sein Herz das Lot ist. Welcher Gott hat (wörtl.: ist wie) die Größe des Thoth, (Denn) sie sind zahlreich, die Truppen mit/aus der (strafenden) Machtserscheinung Gottes. derjenige, der diese Sachen erfunden hat, um sie zu benutzen? Benutze du (oder: mache dir) keine beschädigten/verringerten Kite-Gewichte!, Wozu gibt es ihn, einen (kostbaren) (langen) swH-Schurz aus mk-Stoff (?; oder: einen <in> mk-Stoff Gehüllten), wenn er in Anwesenheit des Gottes schwindelt?, Hüte dich davor, das {Udjat-Auge} <Scheffel-Meßgefäß> zusammenzupressen (?), um seine Teile/Untergliederungen zu verfälschen., Was das Oipe-Meßgefäß angeht, (es ist) das Auge des Re. Sein (d.h. des Auges) Abscheu gilt dem Dieb. Was einen (Korn)messer angeht, der eranlaßt/zugelassen hat, daß häufig geschwindelt wird: sein Auge (das des Re) wird (das Urteil) über ihn besiegeln., Größer ist die (göttliche) Machtserscheinung des Dreschplatzes der Gerste, als ein Eid beim (königlichen) Großen Thron (wörtl.: des Großen Thrones)., Lege dich nicht zu schlafen hin mit Angst für den morgigen Tag (wörtl.: indem du dich vor dem Morgen fürchtest)! Bei Tagesanbruch, wie ist (dann) der morgige Tag? Der Mensch (wörtl.: Mann) weiß (doch) nicht, wie der morgige Tag ist. Wenn der Gott in seinen Qualitäten ist, dann ist der Mensch (wörtl.: Mann) in seinen Unzulänglichkeiten. Die Worte, die die Menschen gesagt haben, sind eine Sache (wörtl.: werden weggeräumt/entfernt, d.h. auf eine Seite gesetzt), die Taten des Gottes sind eine andere Sache (wörtl.: werden weggeräumt/entfernt, d.h. auf eine andere Seite gesetzt)., Sage nicht: ""(Ich) bin ohne Sünde/Vergehen"", und bemühe dich (daher) nicht, eine Störung zu versuchen! Was die Sünde angeht, sie gehört dem Gott; sie ist mit seinem Finger versiegelt. Es gibt keine Vorzüglichkeit in der Hand des Gottes, und es gibt kein Versagen in seiner Anwesenheit. Wenn er danach strebt (wörtl.: wenn er sich mitzieht), die Vorzüglichkeit zu suchen: einen Augenblick später wird er sie/sich verletzen. Sei gewichtig in deinem jb-Herzen; Festige dein HAtj-Herz! Steuere nicht mit deiner Zunge! Was die Zunge des Menschen angeht: (das ist) das Ruder des Schiffes; (aber) der Allherr ist sein Lotse., Bemühe dich nicht um einen Eid beim Herrn (d.h. einen Königseid), (sondern) rede (in einfacher Sprache) <im> Untersuchungshof! Sage die Wahrheit vor dem hohen Beamten, damit er sich nicht deiner Person bemächtige. In Zukunft (wörtl.: am (?) nächsten Morgen) dann, wenn du vor ihn trittst, da wird er mit allen deinen Worten einstimmen., Was die Wahrheit angeht, (sie ist) eine große Gabe Gottes. Er gibt sie (nur) dem, den er liebt. Was die Kraft dessen angeht, der wie er ist, sie rettet den Elenden vor seinen Stockschlägen (d.h. vor dem Prügel, den er zu erwarten hat). Mache dir keine falschen Tagebücher! Sie sind eine große Verleumdung/Provokation (?), die den Tod verdient (wörtl.: des Todes). Sie <ziehen> einen großen Eid der Treuebezeugung <nach sich>., Verfälsche kein Orakel im Protokoll (wörtl.: auf der Buchrolle), und bringe nicht die Pläne Gottes durcheinander! Erfinde nicht für dich selbst eine Machtserscheinung Gottes, als ob (wörtl.: indem) es Schai und Renenet nicht (mehr) gibt., Laß nicht zu, daß dein Herz in ihren Häusern baut (oder: mit ihren Häusern aufgebaut wird), wobei dein(e) Knochen für den Exekutionsblock bestimmt wäre(n)., Sage nicht: ""Finde mir einen Erlöser/Protektor, weil ich einen, den ich hasse, verletzt habe (oder: weil einer, der mich hasst, mich verletzt hat)."" Und außerdem kennst du nicht die Pläne Gottes, so daß du dich <am/wegen> Morgen nicht schämen mußt. Setze dich in die Arme des Gottes! Deine Zurückhaltendheit (wörtl.: dein Schweigen) wird sie (die Angreifer von Versen 22.2 und 22.4) unterwerfen (?)., Was ein Krokodil angeht, das dem Rufen entbehrt (wörtl.: entleert ist, ausgeschöpft hat), sein Ansehen ist altehrwürdig/existiert seit langem., Und außerdem kennst du nicht die Pläne Gottes, so daß du dich <am/wegen> Morgen nicht schämen mußt. Setze dich in die Arme des Gottes! Deine Zurückhaltung (wörtl.: dein Schweigen) wird sie (die Diskussionsgegner) unterwerfen (?)., Was das Herz eines Menschen angeht, (das ist) der Schnabel Gottes (wörtl.: die Nase des (Ibis)gottes). Hüte dich davor, es zu vernachlässigen!, Verspotte keinen Mann/Menschen, der in der Hand des Gottes ist (d.h. ein Besessener?), und mache kein wütendes Gesicht gegen ihn, damit er verletzt wird! Was den Menschen angeht, (er ist) Lehm und Stroh; der Gott ist sein Baumeister. Er bricht ab und er baut auf täglich; er macht 1000 abhängige Leute, wie es ihm gefällt. Er macht 1000 Menschen zu Aufsehern, wenn er in seiner Stunde des Lebens ist. Wie sehr freut er sich, der den Westen erreicht hat, wobei er wohlbehalten in (oder: bewahrt vor?) der Hand des Gottes ist., Ob einer (wörtl.: er) (noch) ein junger Mann ist, (aber schon) ein Großer in seinem Amt, oder (ob er) ein Greis von Geburt (ist), freunde dich mit einem Mann deiner Verhältnisse/Art an, damit Re in der Ferne wohlbehalten ist., Beleidige/verfluche keinen, der größer/älter ist als du, weil er Re vor dir erblickt hat. Laß ihn dich nicht anzeigen (wörtl.: melden) bei der Sonnenscheibe bei dessen Aufgang mit den Worten: ""Wieder ein Kleiner/Junger (oder: irgendein Kleiner; wörtl.: ein anderer Kleiner) hat einen Großen beleidigt/verflucht."" <Über>aus peinlich ist (es) bei Re, ein Kleiner, der einen Großen beleidigt/verflucht., Gott liebt (wörtl.: hat liebgewonnen) den, der den Armen huldigt, (und zwar) mehr als den, der den Vornehmen Respekt erweist., Es gibt keinen Abscheu in der Hand des Gottes, wenn ein Passagier (?) nicht ablehnen (?; oder: übergangen) wird., Wenn sie dem Unwissenden vorgelesen werden, dann pflegt er durch sie rein zu werden (oder: als Reiner aufzutreten)., In der Handschrift des Senu, des Sohnes des Gottesvaters Pamiu., Eingeweihter/Geheimnisvorsteher des Min-Kamutef, Tag 22 (leer) Harsiesis, Wasserspender des Onnophris, <Tag ...> (leer) Anchef Der, der Horus auf dem Thron seines Vaters initiiert/einführt, Tag 26 Der, der für ihn den herrlichen Schrein wachsam umgibt (?)"
"Quellenstellen zur Kultpraxis_Cheti, Lehre des",Ilwet el-Scheich Abd-el-Gurna,Thutmosis III. (Gesamtzeitraum),"Seine Finger sind wie die ""Dinger"" der Krokodile., Wenn er eine Elle der (glänzenden?) Sachen fertiggestellt hat, sind seine Arme gelähmt und ist er erledigt., Man sitzt an über/auf die Nahrung des Re, (indem/wobei) seine Knie und sein Rücken gekrümmt sind., Der Köhler (?): seine Finger sind verwest; ihr Geruch (wörtl.: der Geruch davon) ist (der von) Leichnamen., Kleidung ist, was er verabscheut (wörtl.: sein Abscheu)., Der Sandalenmacher: es geht ihm sehr schlecht, {da muß er bis in Ewigkeit (um Sachen) bitten/flehen (betteln?)} <beladen mit seinen Gefäßen mit Öl>. Ist er unversehrt, so bin ich unversehrt von Leichen., Der Nachbar sind die Krokodile., Er kann keine {Untergetauchten} <Himmelsbewohner> finden., Wenn {(der Gott) Chnum} <(Vogel)schwärme> über {dir} <ihm> vorbeiziehen, dann muß er sagen: ""Gäbe es doch ein Netz!"" Das Herz Gottes wird seine Verwandlung nicht zulassen, indem/weil seine Pläne nachlässig sind (oder: seine Art nachlässig ist)., Es gibt nichts als/an <sein> Arbeitsergebnis im Fluß, vermischt mit Krokodilen., Man kann nicht sagen: ""Das Krokodil steht (dort bereit)"", indem/weil die Angst ihn geblendet hat. Wenn der Vater hervorkommt auf dieses/aus diesem Wasser, indem er wohlbehalten ist (?), dann ist es (eindeutig) wie eine Macht(manifestation) Gottes (oder: ..., dann ist er (zwangsläufig) wie (nach) einer Macht(manifestation) Gottes (d.h. zitternd, betäubt))., Nützlicher für dich ist ein (einziger) Tag im Schulzimmer als eine Ewigkeit an {ihrer} Bergwerksarbeit (?)., Wenn ein Lehmziegel von einem Eiligen gegriffen wird, dann wird man die Art seiner Pläne (?) nicht kennen {durch Löwen aus Lapislazuli}. <Leg Zeugnis ab bei den Richtern!>, Der mit verhülltem Leib, <er> macht sich einen Schild., Wer das Gejubel ausläßt, der hat keinen Namen, der bestehen bleibt (wörtl.: seinen dauerhaften Namen gibt es nicht)., Siehe, Renenet (oder: die Personifizierung des Glücks/Reichtums) ist/befindet sich auf dem Weg Gottes. Die Renenet des Schreibers befindet sich auf seiner Schulter am Tag seiner {Kinder} <Geburt>., Wenn er das Torgebäude erreicht, der Gerichtshof (oder: die Ratsversammlung) ---?---, Die (Geburtsgöttin) Meschenet, die dem Schreiber zugewiesen wird: an die Spitze der Ratsversammlung (oder: des Gerichtshofs) stellt sie ihn. (?), Lobe Gott für deinen Vater und deine Mutter (d.h. bedanke dich bei deinem Vater und deiner Mutter), die <dich> auf den Weg der Lebenden setzen/gesetzt haben., Dies(er Satz) bedeutet, daß es gut und zufriedenstellend (ans Ende) kommt, für {die Nahrung} <den Ka> des fähigen Gelobten, mit vollkommenem Verhalten, den Schatzhausschreiber des Schatzhauses des Pharao, Qagabu., Seine Finger sind wie die ""Dinger"" der Krokodile., Wenn er eine Elle der <(glänzenden?) Sachen> fertiggestellt hat, <sind seine Arme gelähmt und ist er erledigt.>, Siehe, {Renenet ist} <hiermit setze ich dich> auf den Weg Gottes. Es ist so, daß die Renenet (d.h. die Personifizierung des Glücks/Reichtums) des Schreibers auf seiner Schulter ist am Tag {seiner Kinder}, an dem er geboren wird (oder: am Tag seiner Geburt)., Wenn er das Torgebäude erreicht, <sagt> der Gerichtshof (oder: die Ratsversammlung): ""Mögen die Menschen für ihn handeln."" (??), Die (Geburtsgöttin) Meschenet, die dem Schreiber zugewiesen wird: an die Spitze der Ratsversammlung (oder: des Gerichtshofs) stellt sie ihn. (?), Lobe Gott für deinen Vater und deine Mutter (d.h. bedanke dich bei deinem Vater und deiner Mutter), die <dich> auf den Weg der Lebenden setzen/gesetzt haben., Dies(er Satz) bedeutet, daß es gut und zufriedenstellend (ans Ende) kommt, [für den Ka des ..., sein ...], den Schreiber Nebnefer. (Geschrieben von) seinem Assistenten Neferhotep."
