Datei,Herkunft,Datierung,Übersetzung
"Quellenstellen zur Kultpraxis_Ani, Lehre des",(unbestimmt),Dritte Zwischenzeit - 26. Dyn.,"Anfang (aus) der Erziehungslehre, die der Schreiber des Tempels der (Ahmes(?)) Nefertari (namens) Any verfaßt hat., Anfang (aus) der Erziehungslehre, die der Schreiber des Tempels der (Ahmes(?)) Nefertari (namens) Any verfaßt hat., ...] Amun-Re, König der Götter [..., .... Mögest] du [schrei]ten (?) an der [verborgenen (?)] Stätte [..., ...], indem du gepriesen/begünstigt bist., Der Abscheu Gottes ist es, {einen Augenblick zu ergreifen} <in Wut zuzugreifen>., Zeige deinen Vorgesetzten nicht <bei> deinem Gott an (wörtl.: Überweise deinen Vorgesetzten nicht <an> deinen Gott; liefere deinen Vorgesetzten nicht deinem Gott aus)! Er hört (doch) nicht zu., Feiere ein Fest <für> deinen Gott! (Und) du sollst es <zu> seiner (richtigen/bestimmten) Zeit wiederholen. (Denn) Gott ist/wird zornig, wenn sie (die Zeit) verpaßt wird (wörtl.: beim sie Übertreten)., Stelle Zeugen bereit, wenn du {es} opferst, (beim) ersten Mal, an dem du es tust (wörtl.: des es Tun)., Man ist gekommen, um deine Registrierung/Gebühr (?) einzufordern? (Dann) gib sie, um dich auf der Papyrusrolle eintragen zu lassen (wörtl.: um zu veranlassen, daß du auf die Papyrusrolle kommst/hinabsteigst)., Die Zeit ist gekommen (und) man fordert deine Quittung (?) ein, um seine (des Gottes) Macht zu vergrößern (wörtl.: erhöhen)? (Dann) mögen Gesang, Tanz und Weihrauch zu seiner Nahrung werden; (dann) möge die Proskynese/Huldigung als sein Eigentum akzeptiert werden. Um seinen Namen zu verherrlichen (wörtl.: vergrößern), tut es der Gott (d.h. nimmt er Gesang usw. als Nahrung und Besitz zu sich), während/wohingegen der Mensch derjenige ist, der (hinterher von den Opfergaben) berauscht ist., Erzähl es (d.h. das Schlechte) keinem anderen draußen, damit es für dich nicht zu einem Kapitalverbrechen wird, auf das der Tod steht (wörtl.: zu einem großen Verbrechen des Todes), wenn es {nicht} erfahren (wörtl.: gehört) wird., ""Ich bin sanft/zärtlich (oder: juristisch gesehen frei)"", sagt sie dir jeden Tag, wenn sie keine Zeugen hat (wörtl.: keine Zeugen für sie/bei ihr sind), wobei sie dasteht, verstrickt <in> ein Kapitalverbrechen, auf das der Tod steht (wörtl.: des Todes), wenn es bekannt (wörtl.: gehört) wird, obwohl sie das noch (?) gar nicht begriffen hat (wörtl.: trotz/entsprechend ihres es auch/noch (?) Nicht-verstehens)., Mach keinen Lärm in der Kapelle/(privaten) Ruhestätte Gottes! (Denn) Geschrei ist sein Abscheu., Bete doch (oder: für dich) mit einem liebenden Herzen, dessen gesamte Worte verborgen (d.h. im Stillen, nur innerlich ausgesprochen) sind. (Dann) wird er deinen Bedarf befriedigen. (Dann) wird er das, was du gesagt hast, erhören. (Dann) wird er deine Opfergabe akzeptieren., Bring eine Wasserspende für deinen Vater und deine Mutter, die im (Toten)tal ruhen. Angebracht (wörtl.: richtig) ist eine Wasserspende, die bei den Göttern (= für die Götter) gemacht wird. <Mit> anderen Worten/anders gesagt: sie nehmen (sie) an. Du sollst der Außenwelt/Öffentlichkeit nicht verschweigen, daß du es tust (wörtl.: du sollst dich nicht unwissend zeigen beim Es-Tun), damit dein Sohn es für dich ebenfalls tun wird., Mach deine Stätte, die im (Toten)tal liegt, vorzüglich, (genauer gesagt) {den Morgen} <die Unterwelt>, die deinen Leichnam verbirgt! Stell es dir an die erste Stelle (wörtl.: vor dir) unter deinen Aufträgen/Geschäften, die in deiner Obhut am wichtigsten sind (wörtl.: die zählen in deiner Hand). Was außerdem (?) die Altehrwürdigen (wörtl.: großen Alten) angeht: mögest du zwischen ihren Sargkammern ruhen. Kein Vorwurf entsteht, wenn man dies anstrebt (wörtl.: für das Es-Tun). Gut geht es dem, der derart gerüstet/vorbereitet ist., Wird dein (Todes)bote kommen, um dich mitzunehmen, (dann) wird er <dich> gerüstet/bereit finden. Wahrlich, <er> macht es sich deinetwegen nicht bequem (d.h. er wartet nicht, legt keine Pause ein) mit der Begründung (wörtl.: um zu sagen): ""Siehe, der, der gekommen ist, (um dich mitzunehmen,) er hat sich (schon) vor dir fertig gemacht."" Sage nicht: ""Ich bin ein zu junger Bursche, als daß du <mich> mitnimmst"", weil du (den Augenblick) deines Todes nicht kennst. Wird der Tod kommen, (dann) wird er das Kind, (insbesondere das,) das (noch) auf dem Schoß seiner Mutter ist, {geleiten} <rauben>, ebenso wie den, der alt geworden ist., Mögest du gepriesen [werden] (?) als ein Mann, der zu seinen Plänen steht (?)., Möge dein Gott dafür sorgen, daß dir Kinder zuteil werden., Du sollst dich nicht gedankenlos verhalten (wörtl.: nicht die Rolle eines ohne Herzen/Vernunft spielen), wenn dein Gott (dir) Vermögen gegeben hat., Geh jeden Tag auf dem Pfad der Gepflogenheiten (wörtl.: gemäß der Straße der Bräuche), damit du nach der üblichen Vorgehensweise (?; wörtl.: die Stätte der Gangart) auftrittst., Der Gott richtet/erkennt den Gerechten, wenn sein (des Gerechten oder des Angreifers?) Schicksal gekommen ist, um ihn fortzunehmen., Opfere deinem Gott! Hüte dich vor seinem Tabu! Du sollst seine Prozessionsstatue nicht hinterfragen! (?) Erlaube dir keine Freiheiten mit ihm nach seinem Erscheinen! Drängle dich nicht an ihn heran, um ihn zu tragen! Du sollst das Orakel nicht stören/manipulieren (?)! Hüte dich! Von seinem Schutz wird er (dir) (dann) noch mehr geben. oder: Zusätzlich zu seinem Schutz wird er (dich) (dann) beschenken., Halte dir seine Art, zu zürnen, vor Augen (wörtl.: Achte <mit> deinem Auge genau auf seine Art, zu zürnen), (und) küsse die Erde in seinem Namen! Er zeigt (seine) Macht <in> Millionen von Formen, <um> den groß zu machen, der ihn groß macht. Was den Gott dieses Landes angeht, (das ist) das Licht/der Lichtgott <im> Himmel, wobei seine Statuen auf Erden sind. Möge Weihrauch täglich als ihre Nahrung gegeben werden, <um> den Herrn der Erscheinungen/des (Sonnen)aufgangs zu stärken., Gib keinen Anlaß, daß sie dich tadelt, daß sie ihre Arme {nicht} zu dem (persönlichen) Gott erhebt, (und) daß er ihr Geschrei (er)hört. oder: Sorge dafür, daß sie dich nicht tadeln muß, daß sie ihre Arme nicht zu dem (persönlichen) Gott erhebt und daß er ihr Geschrei (nicht) (er)hört., Ein Mensch entwickelt sich nicht <auf> eine einzige Art. (?) Er ist dem Herrn des Lebens Antwort schuldig. (?), Beeile dich nicht, <um> den anzugreifen, {das Ende} der dich <angegriffen hat>! (?) Überlaß (wörtl.: gib) ihn dem (persönlichen) Gott! Du sollst ihn täglich dem (persönlichen) Gott erneut melden, wobei der morgige Tag ähnlich wie der heutige ist (wörtl.: das Gleiche vom heutigen Tag ist). (Aber erst) wenn er den geschunden haben wird, der dich geschunden hat, wirst du sehen, was der (persönliche) Gott getan hat., Stelle den Ach-Geist/Dämon zufrieden! Tue das, was er mag! Halte dich seinetwegen rein <von> dem, was er verabscheut, damit du wohlbehalten vor den vielen von ihm verursachten Schädigungen sein wirst. Hüte <dich vor> jeglichem Schaden! Das domestizierte Kleinvieh ist vom/auf dem Feld gestohlen worden? Er ist es, der so etwas tut. Was Schäden/Verluste <auf> dem Dreschplatz auf dem Feld angeht: ""(Das ist) der Ach-Geist/Dämon!"" sagt man auch (dazu). Wenn er Unruhe in {s}einem Haus verursacht, wenden die Herzen sich (voneinander) ab (oder: sind die Herzen entzweit). Auch dann flehen sie (d.h. die Herzen) ihn alle zusammen an., (Nur) von {Jubiläumsfest} <Festgaben> lebt er., Du wirst in die Stadt hineingehen vor dem Tumult (?), (und) du wirst herausgehen, indem du sicher (wörtl.: unversehrt) vor {deinem} <seinem> Zugriff (wörtl.: Hand) bist (?)., Der Kampfstier (Wildstier), der (schon) <auf> der Koppel (oder: <im> Stall) tötete, er wußte nicht, (wie) der Kampfplatz zu verlassen ist., Die kjry-Äffin trägt die Situla, obwohl ihre Mutter sie nicht getragen hat., Was den Menschen angeht, (er ist) ähnlich wie Gott (wörtl.: der Zweite von Gott). Ihr (beider) Gewohnheit ist, einen Mann mit seiner Aussage anzuhören. (Aber) kennt der eine seinen Gefährten (wirklich)?, Ein Einziger ist mit gutem Verstand (wörtl.: mit Herz Herz) entstanden, während die ganze Menschenmenge töricht (veranlagt) ist. Alles, was du gesagt hast, ist vorzüglich als Handlung (oder: ist in der Tat vorzüglich). (Aber) es ist durch einen (oder: mit Hilfe von einem) Ach-Geist <bestimmt/entschieden worden>. Sag dem (persönlichen) Gott, der dir Klugheit gegeben hat: ""Setz {sie/es} <ihn> (?) auf deinen Weg!"", Das krumme Holz, zurückgelassen auf dem Feld, nachdem es für die Sonne und den Schatten (weg)geworfen wurde: der (Holz)-Handwerker hat es sich geholt (oder: wird es sich holen), damit er es begradigt und damit er es <zu> einem Würdenstab eines Großen (oder: einen Stock eines Alten) macht., ""Beachte (doch)"", sagt er (gemeint: der Sohn), ""(o du,) sein (des Handwerkers) Ebenbild, (o du) handgreiflicher Weiser (wörtl.: der kräftig ist mit seiner Hand), das Kind, das auf dem Schoß seiner Mutter ist, dessen (einziger) Wunsch es ist, gesäugt zu werden (wörtl.: indem sein Herz das ihn-Säugen ist)."
"Quellenstellen zur Kultpraxis_Ani, Lehre des","Saqqara, Nekropolen",Dritte Zwischenzeit - Spätzeit,"Anfang (aus) der Erziehungslehre, die der Schreiber des Tempels der (Ahmes(?)) Nefertari (namens) Any verfaßt hat., Anfang (aus) der Erziehungslehre, die der Schreiber des Tempels der (Ahmes(?)) Nefertari (namens) Any verfaßt hat., ...] Amun-Re, König der Götter [..., .... Mögest] du [schrei]ten (?) an der [verborgenen (?)] Stätte [..., ...], indem du gepriesen/begünstigt bist., Der Abscheu Gottes ist es, {einen Augenblick zu ergreifen} <in Wut zuzugreifen>., Zeige deinen Vorgesetzten nicht <bei> deinem Gott an (wörtl.: Überweise deinen Vorgesetzten nicht <an> deinen Gott; liefere deinen Vorgesetzten nicht deinem Gott aus)! Er hört (doch) nicht zu., Feiere ein Fest <für> deinen Gott! (Und) du sollst es <zu> seiner (richtigen/bestimmten) Zeit wiederholen. (Denn) Gott ist/wird zornig, wenn sie (die Zeit) verpaßt wird (wörtl.: beim sie Übertreten)., Stelle Zeugen bereit, wenn du {es} opferst, (beim) ersten Mal, an dem du es tust (wörtl.: des es Tun)., Man ist gekommen, um deine Registrierung/Gebühr (?) einzufordern? (Dann) gib sie, um dich auf der Papyrusrolle eintragen zu lassen (wörtl.: um zu veranlassen, daß du auf die Papyrusrolle kommst/hinabsteigst)., Die Zeit ist gekommen (und) man fordert deine Quittung (?) ein, um seine (des Gottes) Macht zu vergrößern (wörtl.: erhöhen)? (Dann) mögen Gesang, Tanz und Weihrauch zu seiner Nahrung werden; (dann) möge die Proskynese/Huldigung als sein Eigentum akzeptiert werden. Um seinen Namen zu verherrlichen (wörtl.: vergrößern), tut es der Gott (d.h. nimmt er Gesang usw. als Nahrung und Besitz zu sich), während/wohingegen der Mensch derjenige ist, der (hinterher von den Opfergaben) berauscht ist., Erzähl es (d.h. das Schlechte) keinem anderen draußen, damit es für dich nicht zu einem Kapitalverbrechen wird, auf das der Tod steht (wörtl.: zu einem großen Verbrechen des Todes), wenn es {nicht} erfahren (wörtl.: gehört) wird., ""Ich bin sanft/zärtlich (oder: juristisch gesehen frei)"", sagt sie dir jeden Tag, wenn sie keine Zeugen hat (wörtl.: keine Zeugen für sie/bei ihr sind), wobei sie dasteht, verstrickt <in> ein Kapitalverbrechen, auf das der Tod steht (wörtl.: des Todes), wenn es bekannt (wörtl.: gehört) wird, obwohl sie das noch (?) gar nicht begriffen hat (wörtl.: trotz/entsprechend ihres es auch/noch (?) Nicht-verstehens)., Mach keinen Lärm in der Kapelle/(privaten) Ruhestätte Gottes! (Denn) Geschrei ist sein Abscheu., Bete doch (oder: für dich) mit einem liebenden Herzen, dessen gesamte Worte verborgen (d.h. im Stillen, nur innerlich ausgesprochen) sind. (Dann) wird er deinen Bedarf befriedigen. (Dann) wird er das, was du gesagt hast, erhören. (Dann) wird er deine Opfergabe akzeptieren., Bring eine Wasserspende für deinen Vater und deine Mutter, die im (Toten)tal ruhen. Angebracht (wörtl.: richtig) ist eine Wasserspende, die bei den Göttern (= für die Götter) gemacht wird. <Mit> anderen Worten/anders gesagt: sie nehmen (sie) an. Du sollst der Außenwelt/Öffentlichkeit nicht verschweigen, daß du es tust (wörtl.: du sollst dich nicht unwissend zeigen beim Es-Tun), damit dein Sohn es für dich ebenfalls tun wird., Mach deine Stätte, die im (Toten)tal liegt, vorzüglich, (genauer gesagt) {den Morgen} <die Unterwelt>, die deinen Leichnam verbirgt! Stell es dir an die erste Stelle (wörtl.: vor dir) unter deinen Aufträgen/Geschäften, die in deiner Obhut am wichtigsten sind (wörtl.: die zählen in deiner Hand). Was außerdem (?) die Altehrwürdigen (wörtl.: großen Alten) angeht: mögest du zwischen ihren Sargkammern ruhen. Kein Vorwurf entsteht, wenn man dies anstrebt (wörtl.: für das Es-Tun). Gut geht es dem, der derart gerüstet/vorbereitet ist., Wird dein (Todes)bote kommen, um dich mitzunehmen, (dann) wird er <dich> gerüstet/bereit finden. Wahrlich, <er> macht es sich deinetwegen nicht bequem (d.h. er wartet nicht, legt keine Pause ein) mit der Begründung (wörtl.: um zu sagen): ""Siehe, der, der gekommen ist, (um dich mitzunehmen,) er hat sich (schon) vor dir fertig gemacht."" Sage nicht: ""Ich bin ein zu junger Bursche, als daß du <mich> mitnimmst"", weil du (den Augenblick) deines Todes nicht kennst. Wird der Tod kommen, (dann) wird er das Kind, (insbesondere das,) das (noch) auf dem Schoß seiner Mutter ist, {geleiten} <rauben>, ebenso wie den, der alt geworden ist., Mögest du gepriesen [werden] (?) als ein Mann, der zu seinen Plänen steht (?)., Möge dein Gott dafür sorgen, daß dir Kinder zuteil werden., Du sollst dich nicht gedankenlos verhalten (wörtl.: nicht die Rolle eines ohne Herzen/Vernunft spielen), wenn dein Gott (dir) Vermögen gegeben hat., Geh jeden Tag auf dem Pfad der Gepflogenheiten (wörtl.: gemäß der Straße der Bräuche), damit du nach der üblichen Vorgehensweise (?; wörtl.: die Stätte der Gangart) auftrittst., Der Gott richtet/erkennt den Gerechten, wenn sein (des Gerechten oder des Angreifers?) Schicksal gekommen ist, um ihn fortzunehmen., Opfere deinem Gott! Hüte dich vor seinem Tabu! Du sollst seine Prozessionsstatue nicht hinterfragen! (?) Erlaube dir keine Freiheiten mit ihm nach seinem Erscheinen! Drängle dich nicht an ihn heran, um ihn zu tragen! Du sollst das Orakel nicht stören/manipulieren (?)! Hüte dich! Von seinem Schutz wird er (dir) (dann) noch mehr geben. oder: Zusätzlich zu seinem Schutz wird er (dich) (dann) beschenken., Halte dir seine Art, zu zürnen, vor Augen (wörtl.: Achte <mit> deinem Auge genau auf seine Art, zu zürnen), (und) küsse die Erde in seinem Namen! Er zeigt (seine) Macht <in> Millionen von Formen, <um> den groß zu machen, der ihn groß macht. Was den Gott dieses Landes angeht, (das ist) das Licht/der Lichtgott <im> Himmel, wobei seine Statuen auf Erden sind. Möge Weihrauch täglich als ihre Nahrung gegeben werden, <um> den Herrn der Erscheinungen/des (Sonnen)aufgangs zu stärken., Gib keinen Anlaß, daß sie dich tadelt, daß sie ihre Arme {nicht} zu dem (persönlichen) Gott erhebt, (und) daß er ihr Geschrei (er)hört. oder: Sorge dafür, daß sie dich nicht tadeln muß, daß sie ihre Arme nicht zu dem (persönlichen) Gott erhebt und daß er ihr Geschrei (nicht) (er)hört., Ein Mensch entwickelt sich nicht <auf> eine einzige Art. (?) Er ist dem Herrn des Lebens Antwort schuldig. (?), Beeile dich nicht, <um> den anzugreifen, {das Ende} der dich <angegriffen hat>! (?) Überlaß (wörtl.: gib) ihn dem (persönlichen) Gott! Du sollst ihn täglich dem (persönlichen) Gott erneut melden, wobei der morgige Tag ähnlich wie der heutige ist (wörtl.: das Gleiche vom heutigen Tag ist). (Aber erst) wenn er den geschunden haben wird, der dich geschunden hat, wirst du sehen, was der (persönliche) Gott getan hat., Stelle den Ach-Geist/Dämon zufrieden! Tue das, was er mag! Halte dich seinetwegen rein <von> dem, was er verabscheut, damit du wohlbehalten vor den vielen von ihm verursachten Schädigungen sein wirst. Hüte <dich vor> jeglichem Schaden! Das domestizierte Kleinvieh ist vom/auf dem Feld gestohlen worden? Er ist es, der so etwas tut. Was Schäden/Verluste <auf> dem Dreschplatz auf dem Feld angeht: ""(Das ist) der Ach-Geist/Dämon!"" sagt man auch (dazu). Wenn er Unruhe in {s}einem Haus verursacht, wenden die Herzen sich (voneinander) ab (oder: sind die Herzen entzweit). Auch dann flehen sie (d.h. die Herzen) ihn alle zusammen an., (Nur) von {Jubiläumsfest} <Festgaben> lebt er., Du wirst in die Stadt hineingehen vor dem Tumult (?), (und) du wirst herausgehen, indem du sicher (wörtl.: unversehrt) vor {deinem} <seinem> Zugriff (wörtl.: Hand) bist (?)., Der Kampfstier (Wildstier), der (schon) <auf> der Koppel (oder: <im> Stall) tötete, er wußte nicht, (wie) der Kampfplatz zu verlassen ist., Die kjry-Äffin trägt die Situla, obwohl ihre Mutter sie nicht getragen hat., Was den Menschen angeht, (er ist) ähnlich wie Gott (wörtl.: der Zweite von Gott). Ihr (beider) Gewohnheit ist, einen Mann mit seiner Aussage anzuhören. (Aber) kennt der eine seinen Gefährten (wirklich)?, Ein Einziger ist mit gutem Verstand (wörtl.: mit Herz Herz) entstanden, während die ganze Menschenmenge töricht (veranlagt) ist. Alles, was du gesagt hast, ist vorzüglich als Handlung (oder: ist in der Tat vorzüglich). (Aber) es ist durch einen (oder: mit Hilfe von einem) Ach-Geist <bestimmt/entschieden worden>. Sag dem (persönlichen) Gott, der dir Klugheit gegeben hat: ""Setz {sie/es} <ihn> (?) auf deinen Weg!"", Das krumme Holz, zurückgelassen auf dem Feld, nachdem es für die Sonne und den Schatten (weg)geworfen wurde: der (Holz)-Handwerker hat es sich geholt (oder: wird es sich holen), damit er es begradigt und damit er es <zu> einem Würdenstab eines Großen (oder: einen Stock eines Alten) macht., ""Beachte (doch)"", sagt er (gemeint: der Sohn), ""(o du,) sein (des Handwerkers) Ebenbild, (o du) handgreiflicher Weiser (wörtl.: der kräftig ist mit seiner Hand), das Kind, das auf dem Schoß seiner Mutter ist, dessen (einziger) Wunsch es ist, gesäugt zu werden (wörtl.: indem sein Herz das ihn-Säugen ist)."
Quellenstellen zur Kultpraxis_Geistergeschichte von P. Chassinat,(unbestimmt),Dritte Zwischenzeit - Spätzeit,"...]. Er hat den Weg (frei)gegeben (?; oder: Er hat den Weg genommen; oder: Er hat den Weg gezeigt) [..., ...] der Ach zum Ort [..., ...] hochheben an den Himmel [..., ... (den Gott) mit schönem (?)] Gesicht., ""Sowahr ihr lobt [...""  ..., das] der Geringe als Festgewand annimmt [... ...] er/ihm [...] ein Gewand (?), von Neuem (?) geschnitten (?). Nun veranlaßte er, daß er Opfergaben legte auf den Op[fertisch (?) ..., ...]. Er war nicht im Himmel; er war nicht auf der Erde; seine Beine waren vom Boden entfernt [... ... er/sein [...] zu mir (oder: für mich). Nun sagte dieser Ach: ""Ich bin Chentika, der Sohn des Senefer (oder: Senefer, der Sohn des Chentika), O Herrscher, mein Herr [..."""
Quellenstellen zur Kultpraxis_Bes,"Papyrus, bestehend aus ca. 200 Fragmenten v.a. aus Kopenhagen (P. Carlsberg inv. 205) sowie in Florenz, Kairo, Michigan, Oxford, Yale",frühes 2. Jh. n. Chr.,"(x+2,1) [ ... ]. .. , indem sie tranken, indem(?) sie(?) ein Fe[s]t feierten. Es geschah die Vollend[ung] des Festes des Osiris. [ . .. ] ... Bes veranlaßte, daß man einen Vogel brachte. Seine Hand ergriff Räucherwerk (und) Kyphi [ .. . ge]ben Opfer., Sie machten ihre Eide des Bundes vor Isis, (der) Großen. [. . . . .]., die ein Mann des Kampfes machen wird., [Bes stre]ckte seine Hand [aus] und gab sie Haryothes., Er [schr]ieb an ei[ne gel]iebte Frau, die man [Tasis, Tochter des Psintaes], mit Namen nannte, die eine sehr schöne Frau war. Er ließ ihr eine Dotationsschrift machen., Er ließ sie zu seiner Wohnung holen., Er setzte sich mit ihm zum Fest., [sie ließen] ihre Platze des Kämpfens Plätze des Liegens gegen sie sein., Einige böse Pläne [(waren) es, die in das Herz von] Bes kamen. (Es[?]) gefiel(?) seinem Herzen, sagend: ""Nebethetepet, große Göttin! Das gute Vorhaben meines Herzens wird sich nähern zu .[ .. . ], um zu verhindern, daß er mich sieht . .. "", Sowie Tasis das erfuhr, fand sie keinen Ort auf Erden, an dem sie war. Sie öffnete ihren Mund bis zum Boden in einem lauten Schrei, indem sie wehklagte, indem [sie riefe?), indem(?) sie(?)] über Haryothes weinte., Bes sagte zu ihr: »Es gibt keinen Nutzen bei de[m], worin du bist. Möge ich[mit dir] schlafen [ .. . !""] Sie sagte zu ihm: ""(Me)in Bruder Bes, wirst du mit mir schlafen können, während Haryothes, dein Zechkumpan, tot ist ... [ ... ]? Möge ein Sempriester ihm zuerst eine Bestattung machen! Das, w[o]rin du ihn hast ruhen lassen: das, was du von mir willst, werde ich d[ort] tun!"" (x+3,15) Tasis [ließ] Haryothes auf [den] Boden legen und in List zu [seinen(?)] Füße[n](?) ein Grab schaufeln. [Danach(?)] trugen Tasis runde?)] Bes Haryothes. Sie legten ihn hinab in das Grab. Tasis sagte: ""Me[in Bruder Bes!] Ich werde in [das Grab] (hinab) gehen. Ich werde ihn besser liegen lassen."" Tasis ging in d[as] Grab hinab. Sie legte sich [auf(?)] Haryothes. [Sie] k[üßte] ihn. Sie rief hinauf zu Bes: ""Mögest [du(?) dein]e Lanze hinab[geben(?), denn(?) ich(?) werde(?)] veranlassen, daß [Haryothes(?)] sich ... [ ... ]. sein Kopf."" Bes ließ [ihre?) seine(?) Lanze(?)] hina[bgegeben(?) werden(?) ... ] (x+3,20) befestigen die L[an]ze des Bes [ ... ] Bes streckte [seine(?)] Ha[nd] aus [ ... ]. .. [ ... ]. In dem Augenblick hörte der At[em] der Tasis auf. [ ... ].[ ... ] Er erkannte, (daß) Tasis nicht (mehr) lebte., Er ging hinab [in das Grab .... ] tot [ ... Er(?) sagte(?): »Bei Atum,] dem Herrn von [He]liopol[is], dem großen Gott, meinem Gott! D[ie], vor der . .. [ . . ].[ ... « ... , ind]em er [sie(?)] sah, [indem(?) sie(?)] die geliebte Frau [war] . Er fand sie, indem sie wie ein(e) Lotusknospe auf einer Wasser(fläche) war ... [ ... ], ehe ihre Farbe verändert war., [Es(?)] gesch[ah], (x+3,25) daß er kam, um mit ihr zu schlafen. Er sah eine Frauengestalt, (eine) mnx.t-Kleid-Trägerin, die oben vor dem Grab, in(?) dem sie(?) lagen, stand, während sie [zu(?) ihm(?)] sagte: ""Der Fluch des Atum, deines Gottes, sei auf dich geworfen! Du wirst nicht aus (dem) Grab hinaufkommen, bis du die Sache gemacht hast, die für(?) dich bestimmt(?) ist."" Sowie er die Worte hörte, fand er keinen O[rt auf Erden], an dem er [war]. Die große Göttin Isis ließ [ein] Milch . . . auf ihn kommen. Er brachte Lepra.  (In) der nämlichen Stunde (gab es) abscheuliche Wunde(n) [vo]m Scheitel seines Kopfes bis zu den Nägel[n] seiner Füße., Er kam heraus aus (dem) Grab, in dem er mit Tasis geschlafen hatte. Er wandte sein Gesicht zu (dem) Feld. [Er] (x+3,30) fand einen Mann, der wässerte. Er rief ihm zu: ""Geh weg zum ""Großen (Sperr-)Riegel"" von Pernefer! Sage zu Psintaes: ""Deine Tochter ist getötet.!"""", Bes geht mit einem Diener nach Nubien, lebt versteckt in den Wäldern, der Diener muss nach einem Heilmittel suchen, der nubische König erfährt von Bes, besucht ihn, Bes wiegelt die Nubier gegen die Ägypter, d.h. Inaros, auf, Inaros kommt nach Nubien, wird vom König freundlich empfangen, will vermutlich Abgaben einsammeln und Tasis und Haryothes rächen, weil er scheinbar von Bes' Aufenthaltsort weiß, Die Nubier überfallen Inaros nachts nach einem Fest; aller Wahrscheinlichkeit schlagen die Ägypter zurück und besiegen die Nubier, Geschichte in der Geschichte: frühere Abenteuer des Inaros, sprechender Esel, andere Tiere etc."
